{
  "$schema": "http://json-schema.org/draft-07/schema#",
  "title": "UI Component Schema",
  "description": "Schema for defining a UI component in JSON.",
  "type": "object",
  "properties": {
    "schemaVersion": {
      "description": "Version of the component schema used by this JSON file.",
      "type": "integer",
      "minimum": 1
    },
    "type": {
      "description": "The type of the component.",
      "type": "string",
      "enum": [
        "container",
        "stack",
        "scroll",
        "window",
        "label",
        "button",
        "image",
        "slider",
        "progressBar",
        "textField"
      ]
    },
    "name": {
      "description": "A unique identifier for the component.",
      "type": "string"
    },
    "properties": {
      "description": "Component-specific properties.",
      "type": "object"
    },
    "children": {
      "description": "An array of child components.",
      "type": "array",
      "items": {
        "$ref": "#"
      }
    }
  },
  "required": [
    "type"
  ]
}